question	answer	keywords
Will the dishwasher adjust the wash time?	Yes, the dishwasher can adjust the wash time based on how dirty the dishes are and the incoming water temperature.	Counter({'willthedishwasheradjustthewashtime': 1})
How much water does the dishwasher use?	Water usage varies by cycle type. It can be between 2.4 to 7.4 gallons of water per cycle.	Counter({'howmuchwaterdoesthedishwasheruse': 1})
Can I wash plastic dishes in the dishwasher?	Yes, but make sure they are labeled as dishwasher safe to avoid damage.	Counter({'caniwashplasticdishesinthedishwasher': 1})
What is the best way to load dishes?	Load larger items on the bottom rack and smaller items on the top rack. Make sure nothing blocks the spray arms.	Counter({'whatisthebestwaytoloaddishes': 1})
How do I clean the dishwasher filter?	Remove the filter and rinse it under warm water. Scrub gently if needed and replace it after it dries.	Counter({'howdoicleanthedishwasherfilter': 1})
What should I do if my dishwasher smells bad?	Check for food debris in the filter and the bottom of the dishwasher. Clean it out to reduce odors.	Counter({'whatshouldidoifmydishwashersmellsbad': 1})
Can I use regular dish soap in the dishwasher?	No, use only dishwasher detergent made for dishwashers to prevent too many suds.	Counter({'caniuseregulardishsoapinthedishwasher': 1})
How often should I run the dishwasher?	Run the dishwasher whenever you have a full load of dirty dishes to save water and energy.	Counter({'howoftenshouldirunthedishwasher': 1})
What if there are spots on my glasses after washing?	Spots may happen if hard water is present. Consider using a rinse aid to help reduce spots.	Counter({'whatiftherearespotsonmyglassesafterwashing': 1})
Is it safe to leave the dishwasher running unattended?	Yes, it is generally safe, but make sure the dishwasher is not damaged or leaking before leaving.	Counter({'isitsafetoleavethedishwasherrunningunattended': 1})
How can I make my dishwasher last longer?	Regularly clean the filter, check for clogs, and use your dishwasher according to the manual to keep it in good shape.	Counter({'howcanimakemydishwasherlastlonger': 1})
How do I start the dishwasher?	Press the Start/Resume button to begin the wash cycle after selecting your desired options.	Counter({'howdoistartthedishwasher': 1})
What should I do if I opened the door during the wash cycle?	Close the door, then press the Start/Resume button again to continue the cycle.	Counter({'whatshouldidoifiopenedthedoorduringthewashcycle': 1})
How can I cancel a wash cycle?	Press the Cancel Drain button, then make sure the door is closed. The dishwasher will drain for 2 minutes to cancel the cycle.	Counter({'howcanicancelawashcycle': 1})
What does the Clean light mean?	The Clean light stays on when the wash cycle has finished successfully.	Counter({'whatdoesthecleanlightmean': 1})
How does the Heat Dry option work?	The Heat Dry option uses a heating element to help dry your dishes faster during the wash cycle.	Counter({'howdoestheheatdryoptionwork': 1})
Can I set a delay for starting the dishwasher?	Yes, press the 4-Hr Delay button to set a 4-hour delay before the wash cycle starts.	Counter({'canisetadelayforstartingthedishwasher': 1})
What happens if I don’t press Start/Resume after opening the door?	The cycle will not continue until you close the door and press the Start/Resume button.	Counter({'whathappensifidontpressstartresumeafteropeningthedoor': 1})
How do I activate the Control Lock feature?	Press and hold the 4-Hr Delay button for 3 seconds to activate the Control Lock and disable all buttons.	Counter({'howdoiactivatethecontrollockfeature': 1})
How do I turn off the Control Lock?	Press and hold the 4-Hr Delay button for 3 seconds again to turn off the Control Lock.	Counter({'howdoiturnoffthecontrollock': 1})
What if I need to add a dish during the wash cycle?	Open the door to add a dish, then close it. You will need to press the Start/Resume button to continue the cycle.	Counter({'whatifineedtoaddadishduringthewashcycle': 1})
How can I tell if my dishes are sanitized?	The Sanitized indicator light will glow when the dishes have been sanitized properly.	Counter({'howcanitellifmydishesaresanitized': 1})
What does the Cancel function do?	The Cancel function stops the current wash cycle and starts the draining process.	Counter({'whatdoesthecancelfunctiondo': 1})
Can I use Heat Dry with any wash cycle?	The Heat Dry option can be used with most cycles, except for the 1-Hour Wash.	Counter({'caniuseheatdrywithanywashcycle': 1})
What should I do if the dishwasher won't start?	Check if you have closed the door properly, and make sure to press the Start/Resume button after that.	Counter({'whatshouldidoifthedishwasherwontstart': 1})
How do I know if the wash cycle is still running?	The Start/Resume button LED will be lit when the cycle is in progress.	Counter({'howdoiknowifthewashcycleisstillrunning': 1})
Is there a certain amount of time for the Heat Dry option?	Heat Dry can add between 8 to 46 minutes to the wash cycle, depending on the cycle selected.	Counter({'isthereacertainamountoftimefortheheatdryoption': 1})
What if the Control Lock is activated and I need to use the dishwasher?	You will need to hold the 4-Hr Delay button for 3 seconds to deactivate the Control Lock.	Counter({'whatifthecontrollockisactivatedandineedtousethedishwasher': 1})
How do I reset the delay time?	Press the Delay button until the desired delay time is displayed to reset it.	Counter({'howdoiresetthedelaytime': 1})
Can I delay the wash cycle for less than 4 hours?	You cannot set a delay shorter than 4 hours with the 4-Hr Delay option.	Counter({'canidelaythewashcycleforlessthan4hours': 1})
What do I do if the Clean indicator doesn't turn on after a cycle?	Check to make sure the cycle was completed, and the door was closed properly during the wash.	Counter({'whatdoidoifthecleanindicatordoesntturnonafteracycle': 1})
What if my dishes are still dirty after a wash?	Make sure to load the dishwasher properly and use the appropriate wash cycle for your load.	Counter({'whatifmydishesarestilldirtyafterawash': 1})
How should I care for the inside of the dishwasher?	Regularly wipe down the interior with a damp cloth and avoid using harsh chemicals.	Counter({'howshouldicarefortheinsideofthedishwasher': 1})
How can I clean the filter in the dishwasher?	Check your manual for the location of the filter, then remove it and rinse it under running water to clean.	Counter({'howcanicleanthefilterinthedishwasher': 1})
How do I set up my dishwasher?	Place your dishwasher on a flat, even surface near a water supply. Connect the water hose and plug in the power cord. Make sure the dishwasher is leveled.	Counter({'howdoisetupmydishwasher': 1})
How do I load the silverware basket?	You can load the silverware basket by placing forks, knives, and spoons inside it. Ensure the front panel is locked before using the bottom rack.	Counter({'howdoiloadthesilverwarebasket': 1})
How do I unlock the silverware basket?	To unlock, grasp the front panel, pull it up, and turn it 90 degrees. Make sure it’s fully in place before pulling the bottom rack out.	Counter({'howdoiunlockthesilverwarebasket': 1})
How can I remove the silverware basket from the door?	To remove it, grasp the basket by the handle, slide it toward the top of the door, and lift it off the holding buttons.	Counter({'howcaniremovethesilverwarebasketfromthedoor': 1})
How do I put the silverware basket back in the door?	Set the silverware basket on the holding buttons and slide it toward the bottom of the door until it clicks into place.	Counter({'howdoiputthesilverwarebasketbackinthedoor': 1})
What are the cup shelves for?	Cup shelves can hold extra cups, stemware, or long items like spatulas. You can fold them down to create more space in the top rack.	Counter({'whatarethecupshelvesfor': 1})
How do I adjust the fold-down tines?	To adjust the tines, grasp the tip of the tine and push it out of the holder. Then, lay the tines down toward the center of the rack.	Counter({'howdoiadjustthefolddowntines': 1})
What are light item clips used for?	Light item clips hold lightweight plastic items in place, like cups and bowls, during washing to prevent them from moving around.	Counter({'whatarelightitemclipsusedfor': 1})
How do I move a light item clip?	To move a clip, pull it up off the tine and reposition it on another tine where you need it.	Counter({'howdoimovealightitemclip': 1})
What are EZ Adjust Tines?	EZ Adjust Tines are sliding tines on the lower rack that can move left or right. They help fit larger dishes, like cereal bowls.	Counter({'whatareezadjusttines': 1})
How does the silverware spray work?	The silverware spray provides a strong shower of water to the in-door basket, helping to clean stuck-on food without needing to rewash.	Counter({'howdoesthesilverwarespraywork': 1})
How do I turn on the dishwasher?	To turn on the dishwasher, close the door securely. Then, select your wash cycle and press the start button.	Counter({'howdoiturnonthedishwasher': 1})
Should I rinse my dishes before putting them in the dishwasher?	Rinsing is not necessary but scraping off large food particles helps ensure better washing.	Counter({'shouldirinsemydishesbeforeputtingtheminthedishwasher': 1})
What's the best way to load the bottom rack?	Load larger items like pots and pans in the bottom rack. Place them facing down for the best cleaning.	Counter({'whatsthebestwaytoloadthebottomrack': 1})
Can I wash plastic dishes in the dishwasher?	Yes, you can wash plastic dishes, but place them on the top rack to avoid melting.	Counter({'caniwashplasticdishesinthedishwasher': 1})
How do I clean the filters in the dishwasher?	Remove the bottom rack, locate the filters, and rinse them under running water to remove any debris.	Counter({'howdoicleanthefiltersinthedishwasher': 1})
What should I do if my dishwasher is not starting?	Check if the door is completely closed and latched. Ensure it is plugged in and there’s power to the outlet.	Counter({'whatshouldidoifmydishwasherisnotstarting': 1})
How do I know when my dishwasher cycle is done?	Most dishwashers have a light or an indicator that will turn off when the cycle is complete. Listen for a sound if your model has one.	Counter({'howdoiknowwhenmydishwashercycleisdone': 1})
Can I use regular dish soap in my dishwasher?	No, use only dishwasher detergent. Regular dish soap can create too many bubbles and cause a mess.	Counter({'caniuseregulardishsoapinmydishwasher': 1})
How often should I clean my dishwasher?	Clean the interior and filters monthly. This helps it run more efficiently and extends its life.	Counter({'howoftenshouldicleanmydishwasher': 1})
What if my dishes are coming out dirty?	Make sure you’re loading them correctly, not overcrowding, and that you’re using enough detergent.	Counter({'whatifmydishesarecomingoutdirty': 1})
Is it safe to run the dishwasher when I'm not home?	Yes, it is safe to run the dishwasher when you’re away, but always ensure it's connected properly.	Counter({'isitsafetorunthedishwasherwhenimnothome': 1})
How do I raise the top rack?	Hold the top rack with one hand near the adjuster. With your other hand, pull out the top of the adjuster and raise it to one of the preset positions.	Counter({'howdoiraisethetoprack': 1})
How do I lower the top rack?	Lift up on the top rack and then let it down to lower it.	Counter({'howdoilowerthetoprack': 1})
Can I fit tall items in the dishwasher?	You can fit tall items by raising the top rack to a higher position.	Counter({'canifittallitemsinthedishwasher': 1})
What if the top rack is not level?	Make sure to adjust the rack so it is level for proper use.	Counter({'whatifthetoprackisnotlevel': 1})
How do I remove the top rack?	Pull the upper rack forward about halfway. Open the track stops by flipping them toward the outside, then pull the top rack out of the rails.	Counter({'howdoiremovethetoprack': 1})
What should I do before removing the top rack?	Remove any dishes from the top rack before you take it out of the dishwasher.	Counter({'whatshouldidobeforeremovingthetoprack': 1})
How can I wash larger items?	You can wash larger items by removing the top rack and using the bottom rack.	Counter({'howcaniwashlargeritems': 1})
How do I replace the top rack after removing it?	Gently pull the tracks forward, open the track stops, place the back wheels of the rack into the track slot, and then slide the rack back into the tracks.	Counter({'howdoireplacethetoprackafterremovingit': 1})
What happens if I push the top rack all the way in while replacing it?	Don’t push the rack all the way in yet; just secure the back wheels first and then insert the front wheels.	Counter({'whathappensifipushthetoprackallthewayinwhilereplacingit': 1})
How do I make sure the track stops close after putting the top rack in?	The track stops will automatically close when you push the rack into the dishwasher.	Counter({'howdoimakesurethetrackstopscloseafterputtingthetoprackin': 1})
Is it okay to wash cookie sheets in the dishwasher?	You can wash cookie sheets by removing the top rack first.	Counter({'isitokaytowashcookiesheetsinthedishwasher': 1})
What kind of items can I wash in the top rack?	You can wash smaller items like cups and bowls in the top rack.	Counter({'whatkindofitemscaniwashinthetoprack': 1})
How do I know if the top rack is safe to adjust?	Make sure the top rack is empty and the dishes are removed before adjusting it.	Counter({'howdoiknowifthetoprackissafetoadjust': 1})
What should I do if I can't lift the top rack?	Check if the adjuster mechanism is stuck or blocked by dishes. Make sure the rack is not overloaded.	Counter({'whatshouldidoificantliftthetoprack': 1})
Can I wash pots in the dishwasher?	Pots are best washed in the bottom rack when you remove the top rack.	Counter({'caniwashpotsinthedishwasher': 1})
How do I keep the top rack in place after adjusting?	Once you adjust the top rack, it should stay in place. Ensure it is pushed in securely after usage.	Counter({'howdoikeepthetoprackinplaceafteradjusting': 1})
What do I do if the top rack won’t adjust?	Ensure there's nothing blocking the adjusters. If it’s still stuck, check the manual for troubleshooting steps.	Counter({'whatdoidoifthetoprackwontadjust': 1})
Can I wash large items if the top rack is still in place?	No, larger items should be washed in the bottom rack after removing the top rack.	Counter({'caniwashlargeitemsifthetoprackisstillinplace': 1})
How can I clean the dishwasher itself?	Remove any leftover food particles and wipe the interior with a damp cloth.	Counter({'howcanicleanthedishwasheritself': 1})
Is it safe to put fragile items on the top rack?	Yes, the top rack is designed for lighter and more fragile items.	Counter({'isitsafetoputfragileitemsonthetoprack': 1})
What if dishes are still dirty after a wash cycle?	Check the spray arms to ensure they can move freely and are not blocked.	Counter({'whatifdishesarestilldirtyafterawashcycle': 1})
How should I load the bottom rack?	Place larger items like pots and pans in the bottom rack for a thorough clean.	Counter({'howshouldiloadthebottomrack': 1})
How do I clean the dishwasher filters?	To clean the filters, first turn the Upper Filter Assembly ¼ turn counterclockwise and lift it out. Then, separate the Upper Filter Assembly by gently pulling it apart. Rinse the filters under running water until most soils are removed.	Counter({'howdoicleanthedishwasherfilters': 1})
When should I clean the filters?	Clean the filters when you see visible dirt or if your dishes feel gritty. If cleaning performance drops and soils remain on dishes, it's time to clean the filters.	Counter({'whenshouldicleanthefilters': 1})
How often should I clean the filters?	The cleaning frequency depends on how many loads you do. If you do 8-12 loads a week and only scrape before loading, clean every two months. If you do just 1-3 loads a week, clean twice a year.	Counter({'howoftenshouldicleanthefilters': 1})
What if I have very hard water?	If your water is very hard (above 15 grains), clean your filter at least once a month. Look out for white residue inside the dishwasher as it may indicate hard water.	Counter({'whatifihaveveryhardwater': 1})
What do I do if the dishwasher isn't cleaning well?	If your dishwasher isn't cleaning well, check the filters. They may need to be cleaned if you see dirt or if your dishes are still dirty after a wash.	Counter({'whatdoidoifthedishwasherisntcleaningwell': 1})
What tools do I need to clean the filters?	You only need running water to rinse the filters. If there are hard-to-remove soils, a soft brush might be needed, but do not use wire brushes or scouring pads.	Counter({'whattoolsdoineedtocleanthefilters': 1})
Can I wash the filters in the dishwasher?	It is best to rinse the filters under running water. Washing them in the dishwasher may not clean them properly.	Counter({'caniwashthefiltersinthedishwasher': 1})
What happens if I don’t clean the filters?	Not cleaning the filters can lead to poor cleaning performance and dirty dishes. It can also cause foreign objects to enter the pump.	Counter({'whathappensifidontcleanthefilters': 1})
How do I know if I need to clean the lower filter?	You should clean the lower filter if you notice dirt or food particles on your dishes or if cleaning performance decreases.	Counter({'howdoiknowifineedtocleanthelowerfilter': 1})
Is it hard to remove the filters?	No, it's easy to remove and maintain the filters. Just follow the instructions for turning and lifting them out.	Counter({'isithardtoremovethefilters': 1})
How do I check for hard water buildup?	Look for white residue inside your dishwasher. This indicates hard water, and you may need to clean the filters more often.	Counter({'howdoicheckforhardwaterbuildup': 1})
Can I use soap to clean the filters?	It's better to just rinse the filters under running water without soap. Soap can leave a residue that might affect cleaning.	Counter({'caniusesoaptocleanthefilters': 1})
What type of brush should I use for tough spots?	Use a soft brush to remove any tough soils or calcium deposits. Avoid any hard brushes that can scratch the filters.	Counter({'whattypeofbrushshouldiusefortoughspots': 1})
How can I improve my dishwasher's cleaning power?	To improve cleaning power, make sure to clean the filters regularly and scrape off food before loading dishes. This helps the dishwasher work better.	Counter({'howcaniimprovemydishwasherscleaningpower': 1})
Is it okay to run the dishwasher if the filters are dirty?	Running the dishwasher with dirty filters can lead to poor cleaning results and may damage the appliance. Always clean them for best results.	Counter({'isitokaytorunthedishwasherifthefiltersaredirty': 1})
How do I assemble the Upper Filter Assembly after cleaning?	After cleaning, just align the Upper Filter Assembly and gently push it back together before placing it back in the dishwasher.	Counter({'howdoiassembletheupperfilterassemblyaftercleaning': 1})
Can I use a scouring pad to clean the filters?	No, do not use scouring pads or wire brushes. These can damage the filters and reduce their effectiveness.	Counter({'caniuseascouringpadtocleanthefilters': 1})
What if my dishes still have spots after washing?	If your dishes are spotting after washing, check your filters for clogs. It may also be a sign of hard water, which requires more frequent filter cleaning.	Counter({'whatifmydishesstillhavespotsafterwashing': 1})
How do I store the filters if I remove them for cleaning?	Store the filters in a clean, dry place until you are ready to reassemble them. Avoid leaving them exposed to dust or moisture.	Counter({'howdoistorethefiltersifiremovethemforcleaning': 1})
What should I do if food is stuck on the filters?	If food is stuck, rinse the filters longer under running water and use a soft brush to gently scrub the stuck areas.	Counter({'whatshouldidoiffoodisstuckonthefilters': 1})
Do I need any special products for filter cleaning?	No special products are needed. Simply rinsing under water is usually enough to clean the filters effectively.	Counter({'doineedanyspecialproductsforfiltercleaning': 1})
How do I put the filters back in my dishwasher?	Place the Lower Filter under the tabs at the bottom of the dishwasher. Then, insert the Upper Filter Assembly into the Lower Filter and turn it clockwise until it locks in place.	Counter({'howdoiputthefiltersbackinmydishwasher': 1})
What should I do if the Upper Filter does not seem locked in?	If the Upper Filter spins freely, keep turning it clockwise until it drops and locks into place. Make sure it’s secured before running the dishwasher.	Counter({'whatshouldidoiftheupperfilterdoesnotseemlockedin': 1})
How do I clean the outside of my dishwasher?	Use a soft, damp cloth with mild detergent to clean the exterior. For stainless steel surfaces, use a recommended stainless steel cleaner.	Counter({'howdoicleantheoutsideofmydishwasher': 1})
What is the best way to clean the inside of my dishwasher?	Clean the inside with a paste of powdered dishwasher detergent and water. You can also use liquid detergent on a damp sponge.	Counter({'whatisthebestwaytocleantheinsideofmydishwasher': 1})
How can I remove stains or white spots inside my dishwasher?	Pour 2 cups of white vinegar into a glass on the bottom rack. Run a complete wash cycle without detergent. This can help remove spots.	Counter({'howcaniremovestainsorwhitespotsinsidemydishwasher': 1})
Is it safe to use vinegar in my dishwasher often?	Vinegar can help with stains, but using it too often could damage your dishwasher. Use it occasionally instead of every wash.	Counter({'isitsafetousevinegarinmydishwasheroften': 1})
What is the maintenance procedure for hard water stains?	Use a monthly maintenance cleaner like affresh® Dishwasher Cleaner. Load your dishwasher with soiled dishes, place the tablet in the detergent dispenser, and select an appropriate wash cycle.	Counter({'whatisthemaintenanceprocedureforhardwaterstains': 1})
Should I use regular detergent for maintenance cleaning?	For maintenance cleaning with products like affresh®, use the cleaning tablet instead of regular detergent.	Counter({'shouldiuseregulardetergentformaintenancecleaning': 1})
How can I tell if my dishwasher isn’t draining well?	If you notice water left at the bottom or if your dishes are wet after a wash, it may not be draining well. Check the drain air gap if you have one.	Counter({'howcanitellifmydishwasherisntdrainingwell': 1})
What should I do in summer if I won’t use my dishwasher?	Turn off the water and power supply to the dishwasher when you’re not using it for a long time during summer.	Counter({'whatshouldidoinsummerifiwontusemydishwasher': 1})
How do I protect my dishwasher from freezing in winter?	Make sure the water supply lines are protected against freezing temperatures. Ice can damage your dishwasher and home.	Counter({'howdoiprotectmydishwasherfromfreezinginwinter': 1})
What do I need to do before storing my dishwasher for the winter?	Before winter storage, consider having your dishwasher winterized by authorized service personnel to avoid water damage.	Counter({'whatdoineedtodobeforestoringmydishwasherforthewinter': 1})
Can I run my dishwasher if the filters aren’t in place?	Do not use your dishwasher without the filters properly installed, or it may get damaged.	Counter({'canirunmydishwasherifthefiltersarentinplace': 1})
How should I clean my dishwasher if it smells bad?	A vinegar rinse can help remove odors. Just follow the instructions for cleaning the interior with vinegar.	Counter({'howshouldicleanmydishwasherifitsmellsbad': 1})
What is the best way to clean tough stains in my dishwasher?	Using a dishwasher cleaning product like affresh® can help remove tough stains. Follow the product directions for best results.	Counter({'whatisthebestwaytocleantoughstainsinmydishwasher': 1})
How do I know I am using the right amount of detergent?	For regular use, it's best to use a premeasured detergent tablet or pack. This helps ensure you use the right amount.	Counter({'howdoiknowiamusingtherightamountofdetergent': 1})
What if my dishes are still dirty after a wash?	Make sure the filters are clean and properly installed. Also, check that you are using enough detergent and loading the dishes correctly.	Counter({'whatifmydishesarestilldirtyafterawash': 1})
Is there anything I shouldn’t clean my dishwasher with?	Avoid using harsh chemicals or abrasive cleaners that could scratch or damage the interior and exterior of your dishwasher.	Counter({'isthereanythingishouldntcleanmydishwasherwith': 1})
How often should I clean my dishwasher?	It's a good idea to clean your dishwasher's filters regularly and do a thorough cleaning with vinegar or a dishwasher cleaner at least once a month.	Counter({'howoftenshouldicleanmydishwasher': 1})
Can I leave water in the dishwasher?	It's best to not leave standing water in your dishwasher. If you notice water after a cycle, check for drainage issues.	Counter({'canileavewaterinthedishwasher': 1})
Why isn't my dishwasher running?	Check if the door is closed tightly and latched. Make sure the right cycle is selected and that there is power to the dishwasher.	Counter({'whyisntmydishwasherrunning': 1})
What should I do if the clean light is flashing?	Look for the overfill protection float. It should move freely. Also, make sure the water supply is turned on and check for suds in the dishwasher.	Counter({'whatshouldidoifthecleanlightisflashing': 1})
How can I fix my dishwasher if it won't fill?	Press down on the overfill protection float to make sure it can move up and down freely.	Counter({'howcanifixmydishwasherifitwontfill': 1})
Why does my dishwasher run for a long time?	Try using the 1 Hour Wash cycle. Check if the water is hot enough and that the cycle time is normal for the selected wash.	Counter({'whydoesmydishwasherrunforalongtime': 1})
